{"schemaVersion":"1.0.0","id":"situation-obstacle-advice","contentVersion":1,"name":{"ja-JP":"状況・障害・助言"},"positions":[{"id":"situation","order":1,"meaning":{"ja-JP":"現在の状況を形作っているもの"}},{"id":"obstacle","order":2,"meaning":{"ja-JP":"見落としている障害や緊張"}},{"id":"advice","order":3,"meaning":{"ja-JP":"次に取るべき姿勢や行動"}}],"drawPolicyId":"balanced-two-stage-v1","constraints":{"uniqueCards":true,"uniqueArchetypes":true,"allowReversed":true}}
