{"schemaVersion":"1.0.0","id":"past-present-future","contentVersion":1,"name":{"ja-JP":"過去・現在・未来"},"positions":[{"id":"past","order":1,"meaning":{"ja-JP":"背景となった流れ"}},{"id":"present","order":2,"meaning":{"ja-JP":"現在の状態"}},{"id":"future","order":3,"meaning":{"ja-JP":"このまま進んだ先の傾向"}}],"drawPolicyId":"balanced-two-stage-v1","constraints":{"uniqueCards":true,"uniqueArchetypes":true,"allowReversed":true}}
